{
  "header": {
    "constraint_id": "governance_latency_gap",
    "version": "1.0",
    "generated_date": "2024-01-01",
    "status": "ACTIVE"
  },
  "base_properties": {
    "extractiveness": 0.6,
    "suppression": 0.7,
    "theater_ratio": 0.4,
    "claimed_type": "tangled_rope",
    "human_readable": "The Velocity Mismatch: Governance Latency Gap",
    "topic_domain": "political/technological",
    "requires_active_enforcement": true,
    "beneficiaries": [
      "early_adopters",
      "innovating_firms"
    ],
    "victims": [
      "society_at_large",
      "disadvantaged_communities"
    ]
  },
  "perspectives": [
    {
      "classification_type": "snare",
      "agent_power": "powerless",
      "time_horizon": "generational",
      "exit_options": "trapped",
      "spatial_scope": "global",
      "label": "Society at Large",
      "comment": "Society bears the brunt of unforeseen consequences and lacks immediate recourse or exit options."
    },
    {
      "classification_type": "rope",
      "agent_power": "institutional",
      "time_horizon": "immediate",
      "exit_options": "arbitrage",
      "spatial_scope": "global",
      "label": "Innovating Firms",
      "comment": "Firms benefit from regulatory lag, allowing them to establish market dominance before oversight is implemented."
    },
    {
      "classification_type": "tangled_rope",
      "agent_power": "analytical",
      "time_horizon": "civilizational",
      "exit_options": "analytical",
      "spatial_scope": "global",
      "label": "Analytical Observer",
      "comment": "The observer recognizes both the innovative potential and the inherent risks associated with unregulated technological advancement."
    }
  ],
  "omegas": [
    {
      "id": "predictive_regulatory_capacity",
      "question": "Can regulatory bodies develop sufficient foresight to anticipate and mitigate the risks of emerging technologies before deployment?",
      "resolution_mechanism": "Enhanced collaboration between technologists and policymakers, development of risk assessment frameworks, and investment in regulatory research.",
      "impact": "Improved predictive capacity would shift the classification from Tangled Rope to Rope, indicating a more balanced and proactive governance approach. Failure to improve would solidify the Snare classification for society.",
      "confidence": "medium",
      "type_class": "empirical",
      "description": "Addresses the capacity for predictive and adaptive regulation."
    },
    {
      "id": "stakeholder_alignment",
      "question": "Can diverse stakeholders (industry, government, civil society) align on ethical guidelines and responsible innovation practices?",
      "resolution_mechanism": "Facilitation of multi-stakeholder dialogues, development of shared ethical frameworks, and implementation of transparency mechanisms.",
      "impact": "Greater alignment would reduce the extractiveness of the constraint, potentially shifting the classification towards Scaffold or Rope.",
      "confidence": "medium",
      "type_class": "preference",
      "description": "The ability to align diverse stakeholders on ethical guidelines."
    }
  ],
  "measurements": [
    {
      "metric": "theater_ratio",
      "time_point": 0,
      "value": 0.2
    },
    {
      "metric": "theater_ratio",
      "time_point": 5,
      "value": 0.4
    },
    {
      "metric": "theater_ratio",
      "time_point": 10,
      "value": 0.4
    },
    {
      "metric": "base_extractiveness",
      "time_point": 0,
      "value": 0.3
    },
    {
      "metric": "base_extractiveness",
      "time_point": 5,
      "value": 0.5
    },
    {
      "metric": "base_extractiveness",
      "time_point": 10,
      "value": 0.6
    }
  ],
  "interval": {
    "start": 0,
    "end": 10
  },
  "commentary": {
    "narrative_context": "The Velocity Mismatch describes the scenario where technological innovation outpaces regulatory response. This latency creates opportunities for early adopters and innovating firms to establish market dominance, while society at large and disadvantaged communities bear the brunt of unforeseen consequences and potential harms. The constraint is characterized by a power imbalance where regulators struggle to keep pace with technological advancements, leading to a situation of asymmetric extraction.",
    "key_agents": [
      "Society at Large: Primary victim (powerless/trapped) - suffers from unforeseen consequences.",
      "Disadvantaged Communities: Secondary victim (powerless/trapped) - disproportionately affected.",
      "Innovating Firms: Primary beneficiary (institutional/arbitrage) - benefits from regulatory lag.",
      "Early Adopters: Secondary beneficiary (moderate/mobile) - gains early access and market advantage.",
      "Regulatory Bodies: (moderate/constrained) - struggles to keep pace with technology."
    ],
    "logic_rationale": "The high extractiveness (0.6) reflects the significant costs imposed on society due to the lack of timely regulation. The high suppression (0.7) indicates the limited ability of affected parties to influence or escape the negative consequences. The theater ratio (0.4) shows that regulatory efforts often lag behind the actual impact of the technology.",
    "perspectival_gap": "The perspectival gap arises from the conflicting interests of innovating firms, who benefit from the lack of regulation, and society at large, which bears the risks. Innovating firms experience the constraint as a Rope, allowing them to innovate and capture market share. Society experiences it as a Snare, where they are trapped in a system with little recourse.",
    "directionality_logic": "Innovating firms are beneficiaries (d=0.0) as they profit from the regulatory lag, enabling market dominance. Society at large is a victim (d=1.0) since they bear the risks and negative externalities of the unregulated technology. Regulators attempt to mitigate these risks but often lack the power and resources to be effective (d=0.6).",
    "mandatrophy_analysis": "The Tangled Rope classification accurately captures the dual nature of the constraint, where the benefits of innovation are intertwined with the risks and costs imposed on society. Resolving this mandatrophy requires finding a balance between fostering innovation and ensuring responsible technological development through effective and timely regulation."
  },
  "boltzmann": {
    "coordination_type": "resource_allocation"
  },
  "network": {
    "affects_constraints": [
      "algorithmic_bias",
      "data_privacy_erosion"
    ],
    "dual_formulation_note": "The governance latency gap is a higher-level constraint that enables and exacerbates more specific constraints like algorithmic bias and data privacy erosion."
  },
  "directionality_overrides": []
}
