{
  "header": {
    "constraint_id": "ancient_antibiotic_resistance",
    "version": "1.0",
    "generated_date": "2024-01-01",
    "status": "ACTIVE"
  },
  "base_properties": {
    "extractiveness": 0.15,
    "suppression": 0.05,
    "theater_ratio": 0.1,
    "claimed_type": "mountain",
    "human_readable": "The Inherent Evolutionary Potential for Antibiotic Resistance",
    "topic_domain": "biological/technological",
    "emerges_naturally": true,
    "accessibility_collapse": 0.95,
    "resistance": 0.05
  },
  "perspectives": [
    {
      "classification_type": "mountain",
      "agent_power": "powerless",
      "time_horizon": "civilizational",
      "exit_options": "trapped",
      "spatial_scope": "universal",
      "label": "The Bacteria",
      "comment": "The bacteria are inherently trapped by their own evolutionary constraints."
    },
    {
      "classification_type": "mountain",
      "agent_power": "institutional",
      "time_horizon": "civilizational",
      "exit_options": "analytical",
      "spatial_scope": "universal",
      "label": "The Scientific Community",
      "comment": "The scientific community understands that antibiotic resistance is a natural phenomenon due to evolutionary pressures."
    },
    {
      "classification_type": "mountain",
      "agent_power": "analytical",
      "time_horizon": "civilizational",
      "exit_options": "analytical",
      "spatial_scope": "universal",
      "label": "The Analytical Observer",
      "comment": "From an analytical perspective, antibiotic resistance is an inevitable outcome of evolutionary processes."
    }
  ],
  "interval": {
    "start": 0,
    "end": 5000
  },
  "commentary": {
    "narrative_context": "The discovery of antibiotic resistance mechanisms in ancient bacteria, isolated from 5,000-year-old ice, reveals that resistance is not a modern phenomenon created by human antibiotic use. It demonstrates the inherent evolutionary potential for antibiotic resistance exists independent of human influence, classifying it as a natural law or constraint.",
    "key_agents": [
      "The Bacteria: Inherent carrier of resistance genes (powerless/trapped)",
      "The Scientific Community: Observer and analyzer of the phenomenon (institutional/analytical)",
      "The Analytical Observer: Neutral observer (analytical/analytical)"
    ],
    "logic_rationale": "Extractiveness is low because the constraint is a pre-existing condition, not imposed. Suppression is low as the constraint arises from natural processes. Theater ratio is low because it's a fundamental aspect of evolutionary biology.",
    "perspectival_gap": "All perspectives classify this as a Mountain, indicating a uniform view of antibiotic resistance as a natural, pre-existing phenomenon, regardless of agent position or scope.",
    "directionality_logic": "Directionality is not strongly relevant as this is a naturally occurring constraint. The scientific community and analytical observer are observers, so they are not directly affected. The bacteria are simply acting according to evolutionary pressures.",
    "mandatrophy_analysis": "Mandatrophy is resolved because the categorization as mountain reflects that this is a natural law independent of human action."
  },
  "omegas": [],
  "measurements": [],
  "network": {},
  "directionality_overrides": []
}
