{
  "header": {
    "constraint_id": "ad_synaptic_deficit",
    "version": "1.0",
    "generated_date": "2024-07-15",
    "status": "ACTIVE"
  },
  "base_properties": {
    "extractiveness": 0.55,
    "suppression": 0.85,
    "theater_ratio": 0.1,
    "claimed_type": "tangled_rope",
    "human_readable": "Synaptic Liquidation (Neuro-Degenerative Debt)",
    "topic_domain": "biological/technological",
    "requires_active_enforcement": true,
    "beneficiaries": [
      "pathological_biological_processes",
      "developmental_pruning_mechanisms"
    ],
    "victims": [
      "organism_cognitive_function",
      "neural_network_integrity"
    ]
  },
  "perspectives": [
    {
      "classification_type": "snare",
      "agent_power": "powerless",
      "time_horizon": "biographical",
      "exit_options": "trapped",
      "spatial_scope": "global",
      "label": "The Affected Individual",
      "comment": "PERSPECTIVE 1: AFFECTED INDIVIDUAL (SNARE) — The organism experiencing neurodegeneration is trapped in an irreversible process of functional loss. There is no exit, and the biological mechanism is coercive. d≈0.95, f(d)≈1.42, σ=1.2 → χ≈0.94. This high effective extraction firmly classifies the experience as a Snare."
    },
    {
      "classification_type": "rope",
      "agent_power": "institutional",
      "time_horizon": "immediate",
      "exit_options": "arbitrage",
      "spatial_scope": "local",
      "label": "The Degenerative Cascade",
      "comment": "PERSPECTIVE 2: DEGENERATIVE CASCADE (ROPE) — From the perspective of the pathological process itself (e.g., amyloid cascade), synaptic liquidation is a pure coordination function for its own propagation. It efficiently removes network components to further its own systemic takeover. d≈0.05, f(d)≈-0.12, σ=0.8 → χ≈-0.05. The negative extraction indicates it is a net beneficiary."
    },
    {
      "classification_type": "tangled_rope",
      "agent_power": "analytical",
      "time_horizon": "civilizational",
      "exit_options": "analytical",
      "spatial_scope": "universal",
      "label": "The Analytical Observer",
      "comment": "PERSPECTIVE 3: ANALYTICAL OBSERVER (TANGLED ROPE) — The analytical view recognizes the dual nature of the underlying mechanisms. Synaptic pruning is a necessary coordination function for healthy development (Rope), but in a degenerative context, it becomes a pathological extraction mechanism (Snare). The constraint is therefore a hybrid. d≈0.72, f(d)≈1.15, σ=1.0 → χ≈0.63. This falls within the Tangled Rope range [0.40, 0.90]."
    },
    {
      "classification_type": "scaffold",
      "agent_power": "organized",
      "time_horizon": "biographical",
      "exit_options": "mobile",
      "spatial_scope": "local",
      "label": "The Self-Optimizing Network",
      "comment": "PERSPECTIVE 4: SELF-OPTIMIZING NETWORK (SCAFFOLD) — A hypothetical advanced AI could view controlled synaptic liquidation as a temporary tool for network optimization and pruning. This process would be a scaffold, designed to be removed or superseded once a more efficient architecture is achieved, thus having an implicit sunset clause. d≈0.40, f(d)≈0.40, σ=0.8 → χ≈0.18. This low extraction is consistent with a temporary support structure."
    },
    {
      "classification_type": "mountain",
      "agent_power": "analytical",
      "time_horizon": "civilizational",
      "exit_options": "analytical",
      "spatial_scope": "universal",
      "label": "The Evolutionary Trade-Off",
      "comment": "PERSPECTIVE 5: EVOLUTIONARY TRADE-OFF (MOUNTAIN) — From a sufficiently long timescale, the finite functional lifespan of a biological neural network can be viewed as an immutable consequence of thermodynamic and evolutionary trade-offs. This perspective naturalizes the decay as a fixed limit. However, the engine will flag this as a 'false summit' because the base properties (ε=0.55) are inconsistent with a Mountain classification, revealing this as a naturalistic fallacy."
    }
  ],
  "omegas": [
    {
      "id": "mechanism_reversibility",
      "question": "Is synaptic liquidation a fundamentally irreversible thermodynamic process or a contingent biological mechanism that can be halted or reversed?",
      "resolution_mechanism": "Development of therapies that successfully restore lost synaptic function in advanced neurodegenerative states.",
      "impact": "If reversible, the constraint is a Tangled Rope or Snare. If fundamentally irreversible, it is a Mountain of biology.",
      "confidence": "medium",
      "type_class": "empirical",
      "description": "Whether the process is a fundamental limit or a reversible mechanism"
    },
    {
      "id": "pruning_separability",
      "question": "Can the pathological, extractive aspects of synaptic pruning be functionally separated from its necessary, coordinative role in healthy brain plasticity?",
      "resolution_mechanism": "Identification of distinct molecular pathways for developmental vs. degenerative pruning and targeted inhibition of the latter.",
      "impact": "If separable, the Snare component can be targeted, potentially converting the Tangled Rope into a pure Rope. If inseparable, any intervention risks damaging healthy function.",
      "confidence": "high",
      "type_class": "empirical",
      "description": "Separability of pathological extraction from healthy coordination"
    }
  ],
  "measurements": [
    {
      "metric": "base_extractiveness",
      "time_point": 0,
      "value": 0.2
    },
    {
      "metric": "base_extractiveness",
      "time_point": 10,
      "value": 0.4
    },
    {
      "metric": "base_extractiveness",
      "time_point": 20,
      "value": 0.55
    },
    {
      "metric": "theater_ratio",
      "time_point": 0,
      "value": 0.05
    },
    {
      "metric": "theater_ratio",
      "time_point": 10,
      "value": 0.08
    },
    {
      "metric": "theater_ratio",
      "time_point": 20,
      "value": 0.1
    }
  ],
  "interval": {
    "start": 0,
    "end": 20
  },
  "commentary": {
    "narrative_context": "This constraint models the process of synaptic liquidation, a core feature of neurodegenerative diseases like Alzheimer's. The process is structurally ambiguous: the same biological mechanisms responsible for beneficial synaptic pruning during development become pathological drivers of cognitive decline in disease. This duality, where a coordination function becomes an extraction mechanism, makes it a canonical Tangled Rope from an analytical perspective, while generating vastly different classifications from other structural positions.",
    "key_agents": [
      "Organism/Affected Individual: Primary victim (powerless/trapped) — experiences the constraint as an inescapable loss of self.",
      "Pathological Biological Processes: Primary beneficiary (institutional/arbitrage) — the amyloid cascade or tauopathy, which uses synaptic destruction as a means of propagation.",
      "Clinical Researchers: Secondary actors (moderate/constrained) — attempt to intervene but are constrained by the complexity of the biological system.",
      "Analytical Observer: The systems biologist or theorist (analytical/analytical) — recognizes the dual function of the underlying mechanisms."
    ],
    "logic_rationale": "Extractiveness (ε=0.55): High. Represents the severe and irreversible loss of information processing capacity and cognitive function from the host system. Suppression (0.85): Very high. There are currently no effective means to halt or reverse the process once it is established; biological reality suppresses all alternatives. Theater Ratio (0.10): Low. The process is almost entirely physical and biological, with minimal performative or social ritual overlay.",
    "perspectival_gap": "The gap is profound. For the affected individual, the process is a coercive Snare. For the disease mechanism itself, it's a functional Rope, coordinating its own expansion. For a hypothetical self-optimizing AI, a controlled version would be a temporary Scaffold. For the evolutionary biologist, it can be misperceived as an immutable Mountain. The analytical observer, capable of seeing both the beneficial (developmental) and harmful (degenerative) roles of the mechanism, correctly identifies it as a Tangled Rope.",
    "directionality_logic": "The organism is a trapped victim, deriving a maximal directionality (d≈0.95) and thus experiencing the highest effective extraction (χ). The pathological process is a beneficiary with arbitrage (exploiting cellular resources), deriving a negative directionality (d≈0.05) and experiencing the constraint as a subsidy (negative χ). The analytical observer's position is derived from the canonical value for that power atom (d≈0.72), leading to an intermediate χ that correctly identifies the Tangled Rope structure.",
    "mandatrophy_analysis": "This case resolves the mandatrophy by demonstrating that a single, physical process can be correctly classified as multiple constraint types. The error is to insist on a single 'true' classification. The reality of the constraint is the full presheaf of classifications over the different observer positions. The framework correctly identifies the 'Mountain' view as a false summit, preventing the naturalization of a pathological process, while also validating the 'Snare' experience of the victim and the 'Rope' function for the beneficiary."
  },
  "boltzmann": {
    "coordination_type": "resource_allocation"
  },
  "network": {
    "affects_constraints": [
      "apo_e4_genetic_risk"
    ],
    "dual_formulation_note": "This constraint is downstream of genetic risk factors like 'apo_e4_genetic_risk'. While the genetic constraint may have a low ε reflecting probabilistic risk, ad_synaptic_deficit has a high ε reflecting the deterministic loss of function once the pathological cascade begins."
  }
}
